{
  "schema_id": "gait.gate.approval_audit_record",
  "schema_version": "1.0.0",
  "created_at": "2026-02-05T00:00:00Z",
  "producer_version": "0.0.0-dev",
  "trace_id": "trace_abc123",
  "tool_name": "tool.write",
  "intent_digest": "aaaaaaaaaaaaaaaaaaaaaaaaaaaaaaaaaaaaaaaaaaaaaaaaaaaaaaaaaaaaaaaa",
  "policy_digest": "bbbbbbbbbbbbbbbbbbbbbbbbbbbbbbbbbbbbbbbbbbbbbbbbbbbbbbbbbbbbbbbb",
  "required_approvals": 2,
  "valid_approvals": 2,
  "approved": true,
  "approvers": ["alice", "bob"],
  "entries": [
    {
      "token_id": "token_a",
      "approver_identity": "alice",
      "reason_code": "ticket-123",
      "scope": ["tool:tool.write"],
      "expires_at": "2026-02-05T01:00:00Z",
      "valid": true
    },
    {
      "token_id": "token_b",
      "approver_identity": "bob",
      "reason_code": "ticket-123",
      "scope": ["tool:tool.write"],
      "expires_at": "2026-02-05T01:00:00Z",
      "valid": true
    }
  ]
}
